{
  "$schema": "./schema.json",
  "schemaVersion": 1,
  "id": "explore-your-library",
  "title": "Explore your library",
  "description": "Tour Cove's home page, open a media item, and follow the relationships that connect your library.",
  "order": 30,
  "pages": ["home"],
  "sections": [
    {
      "id": "start-from-home",
      "title": "Start from home",
      "blocks": [
        {
          "type": "paragraph",
          "text": "Start after Cove contains at least a few scanned or imported items. Select the Cove wordmark in the upper-left corner to return home from anywhere in the application."
        },
        {
          "type": "list",
          "items": [
            "Videos, Images, Audios, Texts, and Galleries contain the primary media records.",
            "Segments, Performers, Tags, Groups, and Studios let you browse relationships and organization shared by those records."
          ]
        },
        {
          "type": "paragraph",
          "text": "The home page brings useful parts of both together. Its rows can include recently released media, recently added performers or studios, groups, and personal rows such as Continue Watching. Select View All beside a row for its complete list."
        },
        {
          "type": "image",
          "src": "assets/tutorial-library-home.webp",
          "alt": "Cove home page showing rows of sample videos, studios, groups, and performers",
          "caption": "The sample home page mixes media with the people, studios, and groups that organize it."
        },
        {
          "type": "links",
          "items": [
            { "label": "Media types", "href": "/docs/user/library/media-types/", "topicId": "media-types" }
          ]
        }
      ]
    },
    {
      "id": "open-one-item",
      "title": "Open one item",
      "blocks": [
        {
          "type": "steps",
          "items": [
            "Select Videos in the navigation bar.",
            "Open any video card whose title you recognize. If you have only one scanned item, use that one.",
            "Play a few seconds, then pause. Cove can use that progress for Continue Watching.",
            "Look through the details beside the player before changing anything."
          ]
        },
        {
          "type": "paragraph",
          "text": "A detail page combines descriptive details and file quality; tags, performers, groups, galleries, and source URLs; your rating, favorite, like, and playback state; and tabs for segments, playback filters, file information, history, and editing."
        },
        {
          "type": "image",
          "src": "assets/tutorial-video-detail.webp",
          "alt": "Sample video detail page with metadata and relationships beside the video player",
          "caption": "The sample item connects one video to a studio, three tags, and a group."
        },
        {
          "type": "paragraph",
          "text": "File details describe the source Cove can play. Tags, groups, people, studios, and descriptive fields make that source easier to understand and find. Playback progress and favorites belong to your user rather than changing the shared description for everyone."
        }
      ]
    },
    {
      "id": "follow-a-relationship",
      "title": "Follow a relationship",
      "blocks": [
        {
          "type": "paragraph",
          "text": "Select one tag, performer, studio, or group shown on the item. Cove opens that record so you can see the other library items connected to it. Use Back to return to the item."
        },
        {
          "type": "steps",
          "items": [
            "Start from a media item you know.",
            "Follow a meaningful relationship.",
            "Discover another relevant item.",
            "Return or keep following the library's connections."
          ]
        },
        {
          "type": "links",
          "items": [
            { "label": "Organizing your library", "href": "/docs/user/library/organizing/", "topicId": "organizing" }
          ]
        }
      ]
    },
    {
      "id": "leave-one-personal-breadcrumb",
      "title": "Leave one personal breadcrumb",
      "blocks": [
        {
          "type": "paragraph",
          "text": "Return to Videos and choose the bookmark control on a card to add it to Save for Later. Then open Groups → Save for Later and confirm the item appears. This built-in group is personal and updates automatically; it does not change the item's shared metadata."
        },
        {
          "type": "paragraph",
          "text": "You now know how to move from home to an item, understand its detail page, and browse or save a relationship. Continue by learning when to use global search and when to narrow a single list."
        },
        {
          "type": "links",
          "items": [
            { "label": "Find anything", "href": "/docs/tutorial/find-anything/", "topicId": "find-anything" },
            { "label": "Dynamic and built-in groups", "href": "/docs/user/library/dynamic-groups/", "topicId": "dynamic-groups" }
          ]
        }
      ]
    }
  ]
}
